No.     Time           Source                Destination           Protocol Length Info
    839 16.449449      192.168.68.129        99.236.34.223         TCP      66     35958 → 50008 [SYN] Seq=0 Win=64240 Len=0 MSS=1460 WS=256 SACK_PERM

Frame 839: 66 bytes on wire (528 bits), 66 bytes captured (528 bits) on interface \Device\NPF_{4E8E02EB-6C28-4FD9-BBB8-242929410C55}, id 0
Ethernet II, Src: IntelCor_b3:c1:1c (4c:77:cb:b3:c1:1c), Dst: Tp-LinkT_95:a3:4c (3c:84:6a:95:a3:4c)
Internet Protocol Version 4, Src: 192.168.68.129, Dst: 99.236.34.223
Transmission Control Protocol, Src Port: 35958, Dst Port: 50008, Seq: 0, Len: 0

No.     Time           Source                Destination           Protocol Length Info
    841 16.484638      99.236.34.223         192.168.68.129        TCP      66     50008 → 35958 [SYN, ACK] Seq=0 Ack=1 Win=64240 Len=0 MSS=1460 SACK_PERM WS=128

Frame 841: 66 bytes on wire (528 bits), 66 bytes captured (528 bits) on interface \Device\NPF_{4E8E02EB-6C28-4FD9-BBB8-242929410C55}, id 0
Ethernet II, Src: Tp-LinkT_95:a3:4c (3c:84:6a:95:a3:4c), Dst: IntelCor_b3:c1:1c (4c:77:cb:b3:c1:1c)
Internet Protocol Version 4, Src: 99.236.34.223, Dst: 192.168.68.129
Transmission Control Protocol, Src Port: 50008, Dst Port: 35958, Seq: 0, Ack: 1, Len: 0

No.     Time           Source                Destination           Protocol Length Info
    843 16.484764      192.168.68.129        99.236.34.223         TCP      54     35958 → 50008 [ACK] Seq=1 Ack=1 Win=131328 Len=0

Frame 843: 54 bytes on wire (432 bits), 54 bytes captured (432 bits) on interface \Device\NPF_{4E8E02EB-6C28-4FD9-BBB8-242929410C55}, id 0
Ethernet II, Src: IntelCor_b3:c1:1c (4c:77:cb:b3:c1:1c), Dst: Tp-LinkT_95:a3:4c (3c:84:6a:95:a3:4c)
Internet Protocol Version 4, Src: 192.168.68.129, Dst: 99.236.34.223
Transmission Control Protocol, Src Port: 35958, Dst Port: 50008, Seq: 1, Ack: 1, Len: 0

No.     Time           Source                Destination           Protocol Length Info
    845 16.504754      192.168.68.129        99.236.34.223         TCP      54     35958 → 50008 [RST, ACK] Seq=1 Ack=1 Win=0 Len=0

Frame 845: 54 bytes on wire (432 bits), 54 bytes captured (432 bits) on interface \Device\NPF_{4E8E02EB-6C28-4FD9-BBB8-242929410C55}, id 0
Ethernet II, Src: IntelCor_b3:c1:1c (4c:77:cb:b3:c1:1c), Dst: Tp-LinkT_95:a3:4c (3c:84:6a:95:a3:4c)
Internet Protocol Version 4, Src: 192.168.68.129, Dst: 99.236.34.223
Transmission Control Protocol, Src Port: 35958, Dst Port: 50008, Seq: 1, Ack: 1, Len: 0
