No.     Time           Source                Destination           Protocol Length Info
    870 4.853900       192.168.3.110         99.236.34.223         TCP      66     12423 → 50008 [SYN] Seq=0 Win=64240 Len=0 MSS=1460 WS=256 SACK_PERM

Frame 870: 66 bytes on wire (528 bits), 66 bytes captured (528 bits) on interface \Device\NPF_{4E8E02EB-6C28-4FD9-BBB8-242929410C55}, id 0
Ethernet II, Src: IntelCor_b3:c1:1c (4c:77:cb:b3:c1:1c), Dst: AmpedWir_ab:13:40 (f8:7b:8c:ab:13:40)
Internet Protocol Version 4, Src: 192.168.3.110, Dst: 99.236.34.223
Transmission Control Protocol, Src Port: 12423, Dst Port: 50008, Seq: 0, Len: 0

No.     Time           Source                Destination           Protocol Length Info
    871 4.854122       192.168.3.110         99.236.34.223         TCP      66     12424 → 50006 [SYN] Seq=0 Win=64240 Len=0 MSS=1460 WS=256 SACK_PERM

Frame 871: 66 bytes on wire (528 bits), 66 bytes captured (528 bits) on interface \Device\NPF_{4E8E02EB-6C28-4FD9-BBB8-242929410C55}, id 0
Ethernet II, Src: IntelCor_b3:c1:1c (4c:77:cb:b3:c1:1c), Dst: AmpedWir_ab:13:40 (f8:7b:8c:ab:13:40)
Internet Protocol Version 4, Src: 192.168.3.110, Dst: 99.236.34.223
Transmission Control Protocol, Src Port: 12424, Dst Port: 50006, Seq: 0, Len: 0

No.     Time           Source                Destination           Protocol Length Info
    872 4.854251       192.168.3.110         99.236.34.223         TCP      66     12425 → 50001 [SYN] Seq=0 Win=64240 Len=0 MSS=1460 WS=256 SACK_PERM

Frame 872: 66 bytes on wire (528 bits), 66 bytes captured (528 bits) on interface \Device\NPF_{4E8E02EB-6C28-4FD9-BBB8-242929410C55}, id 0
Ethernet II, Src: IntelCor_b3:c1:1c (4c:77:cb:b3:c1:1c), Dst: AmpedWir_ab:13:40 (f8:7b:8c:ab:13:40)
Internet Protocol Version 4, Src: 192.168.3.110, Dst: 99.236.34.223
Transmission Control Protocol, Src Port: 12425, Dst Port: 50001, Seq: 0, Len: 0

No.     Time           Source                Destination           Protocol Length Info
    873 4.854372       192.168.3.110         99.236.34.223         TCP      66     12426 → 50000 [SYN] Seq=0 Win=64240 Len=0 MSS=1460 WS=256 SACK_PERM

Frame 873: 66 bytes on wire (528 bits), 66 bytes captured (528 bits) on interface \Device\NPF_{4E8E02EB-6C28-4FD9-BBB8-242929410C55}, id 0
Ethernet II, Src: IntelCor_b3:c1:1c (4c:77:cb:b3:c1:1c), Dst: AmpedWir_ab:13:40 (f8:7b:8c:ab:13:40)
Internet Protocol Version 4, Src: 192.168.3.110, Dst: 99.236.34.223
Transmission Control Protocol, Src Port: 12426, Dst Port: 50000, Seq: 0, Len: 0

No.     Time           Source                Destination           Protocol Length Info
    874 4.854505       192.168.3.110         99.236.34.223         TCP      66     12427 → 50002 [SYN] Seq=0 Win=64240 Len=0 MSS=1460 WS=256 SACK_PERM

Frame 874: 66 bytes on wire (528 bits), 66 bytes captured (528 bits) on interface \Device\NPF_{4E8E02EB-6C28-4FD9-BBB8-242929410C55}, id 0
Ethernet II, Src: IntelCor_b3:c1:1c (4c:77:cb:b3:c1:1c), Dst: AmpedWir_ab:13:40 (f8:7b:8c:ab:13:40)
Internet Protocol Version 4, Src: 192.168.3.110, Dst: 99.236.34.223
Transmission Control Protocol, Src Port: 12427, Dst Port: 50002, Seq: 0, Len: 0

No.     Time           Source                Destination           Protocol Length Info
    875 4.873937       99.236.34.223         192.168.3.110         TCP      66     50008 → 12423 [SYN, ACK] Seq=0 Ack=1 Win=64240 Len=0 MSS=1452 SACK_PERM WS=128

Frame 875: 66 bytes on wire (528 bits), 66 bytes captured (528 bits) on interface \Device\NPF_{4E8E02EB-6C28-4FD9-BBB8-242929410C55}, id 0
Ethernet II, Src: AmpedWir_ab:13:40 (f8:7b:8c:ab:13:40), Dst: IntelCor_b3:c1:1c (4c:77:cb:b3:c1:1c)
Internet Protocol Version 4, Src: 99.236.34.223, Dst: 192.168.3.110
Transmission Control Protocol, Src Port: 50008, Dst Port: 12423, Seq: 0, Ack: 1, Len: 0

No.     Time           Source                Destination           Protocol Length Info
    876 4.874139       192.168.3.110         99.236.34.223         TCP      54     12423 → 50008 [ACK] Seq=1 Ack=1 Win=66560 Len=0

Frame 876: 54 bytes on wire (432 bits), 54 bytes captured (432 bits) on interface \Device\NPF_{4E8E02EB-6C28-4FD9-BBB8-242929410C55}, id 0
Ethernet II, Src: IntelCor_b3:c1:1c (4c:77:cb:b3:c1:1c), Dst: AmpedWir_ab:13:40 (f8:7b:8c:ab:13:40)
Internet Protocol Version 4, Src: 192.168.3.110, Dst: 99.236.34.223
Transmission Control Protocol, Src Port: 12423, Dst Port: 50008, Seq: 1, Ack: 1, Len: 0

No.     Time           Source                Destination           Protocol Length Info
    877 4.874192       192.168.3.110         99.236.34.223         TCP      54     12423 → 50008 [RST, ACK] Seq=1 Ack=1 Win=0 Len=0

Frame 877: 54 bytes on wire (432 bits), 54 bytes captured (432 bits) on interface \Device\NPF_{4E8E02EB-6C28-4FD9-BBB8-242929410C55}, id 0
Ethernet II, Src: IntelCor_b3:c1:1c (4c:77:cb:b3:c1:1c), Dst: AmpedWir_ab:13:40 (f8:7b:8c:ab:13:40)
Internet Protocol Version 4, Src: 192.168.3.110, Dst: 99.236.34.223
Transmission Control Protocol, Src Port: 12423, Dst Port: 50008, Seq: 1, Ack: 1, Len: 0

No.     Time           Source                Destination           Protocol Length Info
    878 4.874739       192.168.3.110         99.236.34.223         TCP      66     12428 → 50005 [SYN] Seq=0 Win=64240 Len=0 MSS=1460 WS=256 SACK_PERM

Frame 878: 66 bytes on wire (528 bits), 66 bytes captured (528 bits) on interface \Device\NPF_{4E8E02EB-6C28-4FD9-BBB8-242929410C55}, id 0
Ethernet II, Src: IntelCor_b3:c1:1c (4c:77:cb:b3:c1:1c), Dst: AmpedWir_ab:13:40 (f8:7b:8c:ab:13:40)
Internet Protocol Version 4, Src: 192.168.3.110, Dst: 99.236.34.223
Transmission Control Protocol, Src Port: 12428, Dst Port: 50005, Seq: 0, Len: 0

No.     Time           Source                Destination           Protocol Length Info
    935 5.853695       192.168.3.110         99.236.34.223         TCP      66     [TCP Retransmission] [TCP Port numbers reused] 12427 → 50002 [SYN] Seq=0 Win=64240 Len=0 MSS=1460 WS=256 SACK_PERM

Frame 935: 66 bytes on wire (528 bits), 66 bytes captured (528 bits) on interface \Device\NPF_{4E8E02EB-6C28-4FD9-BBB8-242929410C55}, id 0
Ethernet II, Src: IntelCor_b3:c1:1c (4c:77:cb:b3:c1:1c), Dst: AmpedWir_ab:13:40 (f8:7b:8c:ab:13:40)
Internet Protocol Version 4, Src: 192.168.3.110, Dst: 99.236.34.223
Transmission Control Protocol, Src Port: 12427, Dst Port: 50002, Seq: 0, Len: 0

No.     Time           Source                Destination           Protocol Length Info
    936 5.874125       192.168.3.110         99.236.34.223         TCP      66     [TCP Retransmission] [TCP Port numbers reused] 12428 → 50005 [SYN] Seq=0 Win=64240 Len=0 MSS=1460 WS=256 SACK_PERM

Frame 936: 66 bytes on wire (528 bits), 66 bytes captured (528 bits) on interface \Device\NPF_{4E8E02EB-6C28-4FD9-BBB8-242929410C55}, id 0
Ethernet II, Src: IntelCor_b3:c1:1c (4c:77:cb:b3:c1:1c), Dst: AmpedWir_ab:13:40 (f8:7b:8c:ab:13:40)
Internet Protocol Version 4, Src: 192.168.3.110, Dst: 99.236.34.223
Transmission Control Protocol, Src Port: 12428, Dst Port: 50005, Seq: 0, Len: 0

No.     Time           Source                Destination           Protocol Length Info
    938 5.955514       192.168.3.110         99.236.34.223         TCP      66     12429 → 50005 [SYN] Seq=0 Win=64240 Len=0 MSS=1460 WS=256 SACK_PERM

Frame 938: 66 bytes on wire (528 bits), 66 bytes captured (528 bits) on interface \Device\NPF_{4E8E02EB-6C28-4FD9-BBB8-242929410C55}, id 0
Ethernet II, Src: IntelCor_b3:c1:1c (4c:77:cb:b3:c1:1c), Dst: AmpedWir_ab:13:40 (f8:7b:8c:ab:13:40)
Internet Protocol Version 4, Src: 192.168.3.110, Dst: 99.236.34.223
Transmission Control Protocol, Src Port: 12429, Dst Port: 50005, Seq: 0, Len: 0

No.     Time           Source                Destination           Protocol Length Info
    939 5.955762       192.168.3.110         99.236.34.223         TCP      66     12430 → 50002 [SYN] Seq=0 Win=64240 Len=0 MSS=1460 WS=256 SACK_PERM

Frame 939: 66 bytes on wire (528 bits), 66 bytes captured (528 bits) on interface \Device\NPF_{4E8E02EB-6C28-4FD9-BBB8-242929410C55}, id 0
Ethernet II, Src: IntelCor_b3:c1:1c (4c:77:cb:b3:c1:1c), Dst: AmpedWir_ab:13:40 (f8:7b:8c:ab:13:40)
Internet Protocol Version 4, Src: 192.168.3.110, Dst: 99.236.34.223
Transmission Control Protocol, Src Port: 12430, Dst Port: 50002, Seq: 0, Len: 0

No.     Time           Source                Destination           Protocol Length Info
    940 5.955957       192.168.3.110         99.236.34.223         TCP      66     12431 → 50000 [SYN] Seq=0 Win=64240 Len=0 MSS=1460 WS=256 SACK_PERM

Frame 940: 66 bytes on wire (528 bits), 66 bytes captured (528 bits) on interface \Device\NPF_{4E8E02EB-6C28-4FD9-BBB8-242929410C55}, id 0
Ethernet II, Src: IntelCor_b3:c1:1c (4c:77:cb:b3:c1:1c), Dst: AmpedWir_ab:13:40 (f8:7b:8c:ab:13:40)
Internet Protocol Version 4, Src: 192.168.3.110, Dst: 99.236.34.223
Transmission Control Protocol, Src Port: 12431, Dst Port: 50000, Seq: 0, Len: 0

No.     Time           Source                Destination           Protocol Length Info
    941 5.956130       192.168.3.110         99.236.34.223         TCP      66     12432 → 50001 [SYN] Seq=0 Win=64240 Len=0 MSS=1460 WS=256 SACK_PERM

Frame 941: 66 bytes on wire (528 bits), 66 bytes captured (528 bits) on interface \Device\NPF_{4E8E02EB-6C28-4FD9-BBB8-242929410C55}, id 0
Ethernet II, Src: IntelCor_b3:c1:1c (4c:77:cb:b3:c1:1c), Dst: AmpedWir_ab:13:40 (f8:7b:8c:ab:13:40)
Internet Protocol Version 4, Src: 192.168.3.110, Dst: 99.236.34.223
Transmission Control Protocol, Src Port: 12432, Dst Port: 50001, Seq: 0, Len: 0

No.     Time           Source                Destination           Protocol Length Info
    942 5.956307       192.168.3.110         99.236.34.223         TCP      66     12433 → 50006 [SYN] Seq=0 Win=64240 Len=0 MSS=1460 WS=256 SACK_PERM

Frame 942: 66 bytes on wire (528 bits), 66 bytes captured (528 bits) on interface \Device\NPF_{4E8E02EB-6C28-4FD9-BBB8-242929410C55}, id 0
Ethernet II, Src: IntelCor_b3:c1:1c (4c:77:cb:b3:c1:1c), Dst: AmpedWir_ab:13:40 (f8:7b:8c:ab:13:40)
Internet Protocol Version 4, Src: 192.168.3.110, Dst: 99.236.34.223
Transmission Control Protocol, Src Port: 12433, Dst Port: 50006, Seq: 0, Len: 0

No.     Time           Source                Destination           Protocol Length Info
    946 6.056164       192.168.3.110         99.236.34.223         TCP      66     12434 → 50004 [SYN] Seq=0 Win=64240 Len=0 MSS=1460 WS=256 SACK_PERM

Frame 946: 66 bytes on wire (528 bits), 66 bytes captured (528 bits) on interface \Device\NPF_{4E8E02EB-6C28-4FD9-BBB8-242929410C55}, id 0
Ethernet II, Src: IntelCor_b3:c1:1c (4c:77:cb:b3:c1:1c), Dst: AmpedWir_ab:13:40 (f8:7b:8c:ab:13:40)
Internet Protocol Version 4, Src: 192.168.3.110, Dst: 99.236.34.223
Transmission Control Protocol, Src Port: 12434, Dst Port: 50004, Seq: 0, Len: 0

No.     Time           Source                Destination           Protocol Length Info
    947 6.057115       192.168.3.110         99.236.34.223         TCP      66     12435 → 50003 [SYN] Seq=0 Win=64240 Len=0 MSS=1460 WS=256 SACK_PERM

Frame 947: 66 bytes on wire (528 bits), 66 bytes captured (528 bits) on interface \Device\NPF_{4E8E02EB-6C28-4FD9-BBB8-242929410C55}, id 0
Ethernet II, Src: IntelCor_b3:c1:1c (4c:77:cb:b3:c1:1c), Dst: AmpedWir_ab:13:40 (f8:7b:8c:ab:13:40)
Internet Protocol Version 4, Src: 192.168.3.110, Dst: 99.236.34.223
Transmission Control Protocol, Src Port: 12435, Dst Port: 50003, Seq: 0, Len: 0

No.     Time           Source                Destination           Protocol Length Info
    948 6.057915       192.168.3.110         99.236.34.223         TCP      66     12436 → 50007 [SYN] Seq=0 Win=64240 Len=0 MSS=1460 WS=256 SACK_PERM

Frame 948: 66 bytes on wire (528 bits), 66 bytes captured (528 bits) on interface \Device\NPF_{4E8E02EB-6C28-4FD9-BBB8-242929410C55}, id 0
Ethernet II, Src: IntelCor_b3:c1:1c (4c:77:cb:b3:c1:1c), Dst: AmpedWir_ab:13:40 (f8:7b:8c:ab:13:40)
Internet Protocol Version 4, Src: 192.168.3.110, Dst: 99.236.34.223
Transmission Control Protocol, Src Port: 12436, Dst Port: 50007, Seq: 0, Len: 0

No.     Time           Source                Destination           Protocol Length Info
    949 6.058430       192.168.3.110         99.236.34.223         TCP      66     12437 → 50009 [SYN] Seq=0 Win=64240 Len=0 MSS=1460 WS=256 SACK_PERM

Frame 949: 66 bytes on wire (528 bits), 66 bytes captured (528 bits) on interface \Device\NPF_{4E8E02EB-6C28-4FD9-BBB8-242929410C55}, id 0
Ethernet II, Src: IntelCor_b3:c1:1c (4c:77:cb:b3:c1:1c), Dst: AmpedWir_ab:13:40 (f8:7b:8c:ab:13:40)
Internet Protocol Version 4, Src: 192.168.3.110, Dst: 99.236.34.223
Transmission Control Protocol, Src Port: 12437, Dst Port: 50009, Seq: 0, Len: 0

No.     Time           Source                Destination           Protocol Length Info
    950 6.077410       99.236.34.223         192.168.3.110         TCP      66     50007 → 12436 [SYN, ACK] Seq=0 Ack=1 Win=64240 Len=0 MSS=1452 SACK_PERM WS=128

Frame 950: 66 bytes on wire (528 bits), 66 bytes captured (528 bits) on interface \Device\NPF_{4E8E02EB-6C28-4FD9-BBB8-242929410C55}, id 0
Ethernet II, Src: AmpedWir_ab:13:40 (f8:7b:8c:ab:13:40), Dst: IntelCor_b3:c1:1c (4c:77:cb:b3:c1:1c)
Internet Protocol Version 4, Src: 99.236.34.223, Dst: 192.168.3.110
Transmission Control Protocol, Src Port: 50007, Dst Port: 12436, Seq: 0, Ack: 1, Len: 0

No.     Time           Source                Destination           Protocol Length Info
    951 6.077682       192.168.3.110         99.236.34.223         TCP      54     12436 → 50007 [ACK] Seq=1 Ack=1 Win=66560 Len=0

Frame 951: 54 bytes on wire (432 bits), 54 bytes captured (432 bits) on interface \Device\NPF_{4E8E02EB-6C28-4FD9-BBB8-242929410C55}, id 0
Ethernet II, Src: IntelCor_b3:c1:1c (4c:77:cb:b3:c1:1c), Dst: AmpedWir_ab:13:40 (f8:7b:8c:ab:13:40)
Internet Protocol Version 4, Src: 192.168.3.110, Dst: 99.236.34.223
Transmission Control Protocol, Src Port: 12436, Dst Port: 50007, Seq: 1, Ack: 1, Len: 0

No.     Time           Source                Destination           Protocol Length Info
    952 6.077744       192.168.3.110         99.236.34.223         TCP      54     12436 → 50007 [RST, ACK] Seq=1 Ack=1 Win=0 Len=0

Frame 952: 54 bytes on wire (432 bits), 54 bytes captured (432 bits) on interface \Device\NPF_{4E8E02EB-6C28-4FD9-BBB8-242929410C55}, id 0
Ethernet II, Src: IntelCor_b3:c1:1c (4c:77:cb:b3:c1:1c), Dst: AmpedWir_ab:13:40 (f8:7b:8c:ab:13:40)
Internet Protocol Version 4, Src: 192.168.3.110, Dst: 99.236.34.223
Transmission Control Protocol, Src Port: 12436, Dst Port: 50007, Seq: 1, Ack: 1, Len: 0

No.     Time           Source                Destination           Protocol Length Info
    970 6.156943       192.168.3.110         99.236.34.223         TCP      66     12438 → 50004 [SYN] Seq=0 Win=64240 Len=0 MSS=1460 WS=256 SACK_PERM

Frame 970: 66 bytes on wire (528 bits), 66 bytes captured (528 bits) on interface \Device\NPF_{4E8E02EB-6C28-4FD9-BBB8-242929410C55}, id 0
Ethernet II, Src: IntelCor_b3:c1:1c (4c:77:cb:b3:c1:1c), Dst: AmpedWir_ab:13:40 (f8:7b:8c:ab:13:40)
Internet Protocol Version 4, Src: 192.168.3.110, Dst: 99.236.34.223
Transmission Control Protocol, Src Port: 12438, Dst Port: 50004, Seq: 0, Len: 0

No.     Time           Source                Destination           Protocol Length Info
    971 6.157787       192.168.3.110         99.236.34.223         TCP      66     12439 → 50003 [SYN] Seq=0 Win=64240 Len=0 MSS=1460 WS=256 SACK_PERM

Frame 971: 66 bytes on wire (528 bits), 66 bytes captured (528 bits) on interface \Device\NPF_{4E8E02EB-6C28-4FD9-BBB8-242929410C55}, id 0
Ethernet II, Src: IntelCor_b3:c1:1c (4c:77:cb:b3:c1:1c), Dst: AmpedWir_ab:13:40 (f8:7b:8c:ab:13:40)
Internet Protocol Version 4, Src: 192.168.3.110, Dst: 99.236.34.223
Transmission Control Protocol, Src Port: 12439, Dst Port: 50003, Seq: 0, Len: 0

No.     Time           Source                Destination           Protocol Length Info
    972 6.158873       192.168.3.110         99.236.34.223         TCP      66     12440 → 50009 [SYN] Seq=0 Win=64240 Len=0 MSS=1460 WS=256 SACK_PERM

Frame 972: 66 bytes on wire (528 bits), 66 bytes captured (528 bits) on interface \Device\NPF_{4E8E02EB-6C28-4FD9-BBB8-242929410C55}, id 0
Ethernet II, Src: IntelCor_b3:c1:1c (4c:77:cb:b3:c1:1c), Dst: AmpedWir_ab:13:40 (f8:7b:8c:ab:13:40)
Internet Protocol Version 4, Src: 192.168.3.110, Dst: 99.236.34.223
Transmission Control Protocol, Src Port: 12440, Dst Port: 50009, Seq: 0, Len: 0
