No.     Time           Source                Destination           Protocol Length Info
    259 6.467635       192.168.68.129        99.236.34.223         TCP      66     35139 → 50007 [SYN] Seq=0 Win=64240 Len=0 MSS=1460 WS=256 SACK_PERM

Frame 259: 66 bytes on wire (528 bits), 66 bytes captured (528 bits) on interface \Device\NPF_{4E8E02EB-6C28-4FD9-BBB8-242929410C55}, id 0
Ethernet II, Src: IntelCor_b3:c1:1c (4c:77:cb:b3:c1:1c), Dst: Tp-LinkT_95:a3:4c (3c:84:6a:95:a3:4c)
Internet Protocol Version 4, Src: 192.168.68.129, Dst: 99.236.34.223
Transmission Control Protocol, Src Port: 35139, Dst Port: 50007, Seq: 0, Len: 0

No.     Time           Source                Destination           Protocol Length Info
    260 6.504922       99.236.34.223         192.168.68.129        TCP      66     50007 → 35139 [SYN, ACK] Seq=0 Ack=1 Win=64240 Len=0 MSS=1460 SACK_PERM WS=128

Frame 260: 66 bytes on wire (528 bits), 66 bytes captured (528 bits) on interface \Device\NPF_{4E8E02EB-6C28-4FD9-BBB8-242929410C55}, id 0
Ethernet II, Src: Tp-LinkT_95:a3:4c (3c:84:6a:95:a3:4c), Dst: IntelCor_b3:c1:1c (4c:77:cb:b3:c1:1c)
Internet Protocol Version 4, Src: 99.236.34.223, Dst: 192.168.68.129
Transmission Control Protocol, Src Port: 50007, Dst Port: 35139, Seq: 0, Ack: 1, Len: 0

No.     Time           Source                Destination           Protocol Length Info
    261 6.505073       192.168.68.129        99.236.34.223         TCP      54     35139 → 50007 [ACK] Seq=1 Ack=1 Win=131328 Len=0

Frame 261: 54 bytes on wire (432 bits), 54 bytes captured (432 bits) on interface \Device\NPF_{4E8E02EB-6C28-4FD9-BBB8-242929410C55}, id 0
Ethernet II, Src: IntelCor_b3:c1:1c (4c:77:cb:b3:c1:1c), Dst: Tp-LinkT_95:a3:4c (3c:84:6a:95:a3:4c)
Internet Protocol Version 4, Src: 192.168.68.129, Dst: 99.236.34.223
Transmission Control Protocol, Src Port: 35139, Dst Port: 50007, Seq: 1, Ack: 1, Len: 0

No.     Time           Source                Destination           Protocol Length Info
    262 6.537461       99.236.34.223         192.168.68.129        TCP      91     50007 → 35139 [PSH, ACK] Seq=1 Ack=1 Win=64256 Len=37

Frame 262: 91 bytes on wire (728 bits), 91 bytes captured (728 bits) on interface \Device\NPF_{4E8E02EB-6C28-4FD9-BBB8-242929410C55}, id 0
Ethernet II, Src: Tp-LinkT_95:a3:4c (3c:84:6a:95:a3:4c), Dst: IntelCor_b3:c1:1c (4c:77:cb:b3:c1:1c)
Internet Protocol Version 4, Src: 99.236.34.223, Dst: 192.168.68.129
Transmission Control Protocol, Src Port: 50007, Dst Port: 35139, Seq: 1, Ack: 1, Len: 37
Data (37 bytes)

0000  57 65 63 6f 6d 65 20 74 6f 20 43 4f 4d 50 45 4e   Wecome to COMPEN
0010  47 20 34 44 4e 34 20 45 63 68 6f 20 53 65 72 76   G 4DN4 Echo Serv
0020  65 72 21 20 0a                                    er! .

No.     Time           Source                Destination           Protocol Length Info
    264 6.577678       192.168.68.129        99.236.34.223         TCP      54     35139 → 50007 [ACK] Seq=1 Ack=38 Win=131328 Len=0

Frame 264: 54 bytes on wire (432 bits), 54 bytes captured (432 bits) on interface \Device\NPF_{4E8E02EB-6C28-4FD9-BBB8-242929410C55}, id 0
Ethernet II, Src: IntelCor_b3:c1:1c (4c:77:cb:b3:c1:1c), Dst: Tp-LinkT_95:a3:4c (3c:84:6a:95:a3:4c)
Internet Protocol Version 4, Src: 192.168.68.129, Dst: 99.236.34.223
Transmission Control Protocol, Src Port: 35139, Dst Port: 50007, Seq: 1, Ack: 38, Len: 0

No.     Time           Source                Destination           Protocol Length Info
    557 14.056384      192.168.68.129        99.236.34.223         TCP      92     35139 → 50007 [PSH, ACK] Seq=1 Ack=38 Win=131328 Len=38

Frame 557: 92 bytes on wire (736 bits), 92 bytes captured (736 bits) on interface \Device\NPF_{4E8E02EB-6C28-4FD9-BBB8-242929410C55}, id 0
Ethernet II, Src: IntelCor_b3:c1:1c (4c:77:cb:b3:c1:1c), Dst: Tp-LinkT_95:a3:4c (3c:84:6a:95:a3:4c)
Internet Protocol Version 4, Src: 192.168.68.129, Dst: 99.236.34.223
Transmission Control Protocol, Src Port: 35139, Dst Port: 50007, Seq: 1, Ack: 38, Len: 38
Data (38 bytes)

0000  47 75 72 6b 61 72 61 6e 20 53 6f 6e 64 68 69 20   Gurkaran Sondhi 
0010  2d 20 73 6f 6e 64 68 67 31 20 2d 20 34 30 30 31   - sondhg1 - 4001
0020  39 33 38 30 37 0a                                 93807.

No.     Time           Source                Destination           Protocol Length Info
    558 14.086403      99.236.34.223         192.168.68.129        TCP      54     50007 → 35139 [ACK] Seq=38 Ack=39 Win=64256 Len=0

Frame 558: 54 bytes on wire (432 bits), 54 bytes captured (432 bits) on interface \Device\NPF_{4E8E02EB-6C28-4FD9-BBB8-242929410C55}, id 0
Ethernet II, Src: Tp-LinkT_95:a3:4c (3c:84:6a:95:a3:4c), Dst: IntelCor_b3:c1:1c (4c:77:cb:b3:c1:1c)
Internet Protocol Version 4, Src: 99.236.34.223, Dst: 192.168.68.129
Transmission Control Protocol, Src Port: 50007, Dst Port: 35139, Seq: 38, Ack: 39, Len: 0

No.     Time           Source                Destination           Protocol Length Info
    559 14.086404      99.236.34.223         192.168.68.129        TCP      92     50007 → 35139 [PSH, ACK] Seq=38 Ack=39 Win=64256 Len=38

Frame 559: 92 bytes on wire (736 bits), 92 bytes captured (736 bits) on interface \Device\NPF_{4E8E02EB-6C28-4FD9-BBB8-242929410C55}, id 0
Ethernet II, Src: Tp-LinkT_95:a3:4c (3c:84:6a:95:a3:4c), Dst: IntelCor_b3:c1:1c (4c:77:cb:b3:c1:1c)
Internet Protocol Version 4, Src: 99.236.34.223, Dst: 192.168.68.129
Transmission Control Protocol, Src Port: 50007, Dst Port: 35139, Seq: 38, Ack: 39, Len: 38
Data (38 bytes)

0000  47 75 72 6b 61 72 61 6e 20 53 6f 6e 64 68 69 20   Gurkaran Sondhi 
0010  2d 20 73 6f 6e 64 68 67 31 20 2d 20 34 30 30 31   - sondhg1 - 4001
0020  39 33 38 30 37 0a                                 93807.

No.     Time           Source                Destination           Protocol Length Info
    560 14.134279      192.168.68.129        99.236.34.223         TCP      54     35139 → 50007 [ACK] Seq=39 Ack=76 Win=131072 Len=0

Frame 560: 54 bytes on wire (432 bits), 54 bytes captured (432 bits) on interface \Device\NPF_{4E8E02EB-6C28-4FD9-BBB8-242929410C55}, id 0
Ethernet II, Src: IntelCor_b3:c1:1c (4c:77:cb:b3:c1:1c), Dst: Tp-LinkT_95:a3:4c (3c:84:6a:95:a3:4c)
Internet Protocol Version 4, Src: 192.168.68.129, Dst: 99.236.34.223
Transmission Control Protocol, Src Port: 35139, Dst Port: 50007, Seq: 39, Ack: 76, Len: 0

No.     Time           Source                Destination           Protocol Length Info
    793 21.273698      192.168.68.129        99.236.34.223         TCP      92     35139 → 50007 [PSH, ACK] Seq=39 Ack=76 Win=131072 Len=38

Frame 793: 92 bytes on wire (736 bits), 92 bytes captured (736 bits) on interface \Device\NPF_{4E8E02EB-6C28-4FD9-BBB8-242929410C55}, id 0
Ethernet II, Src: IntelCor_b3:c1:1c (4c:77:cb:b3:c1:1c), Dst: Tp-LinkT_95:a3:4c (3c:84:6a:95:a3:4c)
Internet Protocol Version 4, Src: 192.168.68.129, Dst: 99.236.34.223
Transmission Control Protocol, Src Port: 35139, Dst Port: 50007, Seq: 39, Ack: 76, Len: 38
Data (38 bytes)

0000  41 61 72 6f 6e 20 42 69 6c 6c 6f 6e 65 73 20 2d   Aaron Billones -
0010  20 62 69 6c 6c 6f 6e 65 61 20 2d 20 34 30 30 31    billonea - 4001
0020  38 32 33 39 34 0a                                 82394.

No.     Time           Source                Destination           Protocol Length Info
    794 21.303856      99.236.34.223         192.168.68.129        TCP      92     50007 → 35139 [PSH, ACK] Seq=76 Ack=77 Win=64256 Len=38

Frame 794: 92 bytes on wire (736 bits), 92 bytes captured (736 bits) on interface \Device\NPF_{4E8E02EB-6C28-4FD9-BBB8-242929410C55}, id 0
Ethernet II, Src: Tp-LinkT_95:a3:4c (3c:84:6a:95:a3:4c), Dst: IntelCor_b3:c1:1c (4c:77:cb:b3:c1:1c)
Internet Protocol Version 4, Src: 99.236.34.223, Dst: 192.168.68.129
Transmission Control Protocol, Src Port: 50007, Dst Port: 35139, Seq: 76, Ack: 77, Len: 38
Data (38 bytes)

0000  41 61 72 6f 6e 20 42 69 6c 6c 6f 6e 65 73 20 2d   Aaron Billones -
0010  20 62 69 6c 6c 6f 6e 65 61 20 2d 20 34 30 30 31    billonea - 4001
0020  38 32 33 39 34 0a                                 82394.

No.     Time           Source                Destination           Protocol Length Info
    795 21.352054      192.168.68.129        99.236.34.223         TCP      54     35139 → 50007 [ACK] Seq=77 Ack=114 Win=131072 Len=0

Frame 795: 54 bytes on wire (432 bits), 54 bytes captured (432 bits) on interface \Device\NPF_{4E8E02EB-6C28-4FD9-BBB8-242929410C55}, id 0
Ethernet II, Src: IntelCor_b3:c1:1c (4c:77:cb:b3:c1:1c), Dst: Tp-LinkT_95:a3:4c (3c:84:6a:95:a3:4c)
Internet Protocol Version 4, Src: 192.168.68.129, Dst: 99.236.34.223
Transmission Control Protocol, Src Port: 35139, Dst Port: 50007, Seq: 77, Ack: 114, Len: 0

No.     Time           Source                Destination           Protocol Length Info
   1019 26.198299      192.168.68.129        99.236.34.223         TCP      90     35139 → 50007 [PSH, ACK] Seq=77 Ack=114 Win=131072 Len=36

Frame 1019: 90 bytes on wire (720 bits), 90 bytes captured (720 bits) on interface \Device\NPF_{4E8E02EB-6C28-4FD9-BBB8-242929410C55}, id 0
Ethernet II, Src: IntelCor_b3:c1:1c (4c:77:cb:b3:c1:1c), Dst: Tp-LinkT_95:a3:4c (3c:84:6a:95:a3:4c)
Internet Protocol Version 4, Src: 192.168.68.129, Dst: 99.236.34.223
Transmission Control Protocol, Src Port: 35139, Dst Port: 50007, Seq: 77, Ack: 114, Len: 36
Data (36 bytes)

0000  41 74 69 71 75 6c 20 49 73 6c 61 6d 20 2d 20 69   Atiqul Islam - i
0010  73 6c 61 6d 61 31 35 20 2d 20 34 30 30 31 39 36   slama15 - 400196
0020  32 32 36 0a                                       226.

No.     Time           Source                Destination           Protocol Length Info
   1020 26.226840      99.236.34.223         192.168.68.129        TCP      90     50007 → 35139 [PSH, ACK] Seq=114 Ack=113 Win=64256 Len=36

Frame 1020: 90 bytes on wire (720 bits), 90 bytes captured (720 bits) on interface \Device\NPF_{4E8E02EB-6C28-4FD9-BBB8-242929410C55}, id 0
Ethernet II, Src: Tp-LinkT_95:a3:4c (3c:84:6a:95:a3:4c), Dst: IntelCor_b3:c1:1c (4c:77:cb:b3:c1:1c)
Internet Protocol Version 4, Src: 99.236.34.223, Dst: 192.168.68.129
Transmission Control Protocol, Src Port: 50007, Dst Port: 35139, Seq: 114, Ack: 113, Len: 36
Data (36 bytes)

0000  41 74 69 71 75 6c 20 49 73 6c 61 6d 20 2d 20 69   Atiqul Islam - i
0010  73 6c 61 6d 61 31 35 20 2d 20 34 30 30 31 39 36   slama15 - 400196
0020  32 32 36 0a                                       226.

No.     Time           Source                Destination           Protocol Length Info
   1021 26.276331      192.168.68.129        99.236.34.223         TCP      54     35139 → 50007 [ACK] Seq=113 Ack=150 Win=131072 Len=0

Frame 1021: 54 bytes on wire (432 bits), 54 bytes captured (432 bits) on interface \Device\NPF_{4E8E02EB-6C28-4FD9-BBB8-242929410C55}, id 0
Ethernet II, Src: IntelCor_b3:c1:1c (4c:77:cb:b3:c1:1c), Dst: Tp-LinkT_95:a3:4c (3c:84:6a:95:a3:4c)
Internet Protocol Version 4, Src: 192.168.68.129, Dst: 99.236.34.223
Transmission Control Protocol, Src Port: 35139, Dst Port: 50007, Seq: 113, Ack: 150, Len: 0
